"TID","EN","AR","CN","CNT","DE","ES","FI","FR","HE","ID","IT","JP","KR","MS","NL","PL","PT","RU","TH","TR","VI"
"string","string","string","string","string","string","string","string","string","string","string","string","string","string","string","string","string","string","string","string","string","string"
"TID_DEMONIC_FIRE_DESC","Leave behind a trail of fire that damages enemies.","اترك خلفك أثرًا من النار يلحق الضرر بالأعداء.","在所经之处留下一道烈焰，可对敌人造成伤害。","在所經之處留下一道烈焰，可對敵人造成傷害。","Hinterlasse eine Flammenspur, die Feinden schadet.","Dejas un rastro de fuego que inflige daño a los enemigos.","Jätät jälkeesi tulivanan, joka vahingoittaa vastustajia.","Laisse une traînée de feu qui blesse les ennemis.","השאירו מאחור שובל של אש שתפגע באויבים.","Meninggalkan jejak api yang memberikan kerusakan pada lawan.","Lasci dietro di te una scia di fuoco che danneggia i nemici.","移動時に炎の軌跡を残して敵にダメージを与える。","불길을 남겨 적에게 피해를 줍니다.","Tinggalkan jejak api yang merosakkan musuh.","Laat een pad van vuur achter dat schade toebrengt aan vijanden.","Zostawiasz za sobą ognisty ślad, który zadaje obrażenia wrogom.","Deixa um rastro de fogo que causa dano aos inimigos.","Боец оставляет огненный след, который наносит урон врагам.","ทิ้งเปลวเพลิงไว้ตามทางที่จะสร้างความเสียหายให้กับศัตรู","Arkasında, düşmanlara hasar veren ateşten bir iz bırakır.","Đốt cháy mặt đất phía sau và đám lửa này sẽ gây sát thương lên đối thủ."
"TID_ANGELIC_FRIENDS_DESC","Spawn a healing Angelic Ally when a teammate is defeated. This ally is stronger if the teammate was an Angel.","قم باستدعاء حليف ملائكي معالج عند هزيمة أحد زملائك في الفريق. يكون هذا الحليف أقوى إذا كان زميلك في الفريق ملاكًا.","队友被击倒后，召唤一个能提供治疗的天使伙伴。如果被击倒的队友是天使，那么召唤出来的伙伴会更强大。","隊友被擊殺後，召喚一個能治療隊友的天使夥伴。如果被擊殺的隊友是天使，那麼召喚出來的夥伴會更強大。","Beschwöre einen heilenden Engel als Verbündeten, wenn ein Teamkamerad besiegt wird. War dieser ein Engel, ist der neue Verbündete stärker.","Invoca un compañero angelical curativo cuando derrotan a alguno de tus aliados. El compañero es más fuerte si el aliado era un ángel.","Kun joukkuekaverisi tyrmätään, kutsut parantavan enkeliliittolaisen, joka on voimakkaampi, jos tyrmätty joukkuekaverisi oli enkeli.","Invoque un soigneur angélique quand un équipier est éliminé. Cet allié est plus fort si l'allié était un ange.","כדאי לייצר בעל ברית מרפא מלאכי כשחבר קבוצה מובס. בעל הברית חזק יותר אם אותו חבר צוות היה מלאך.","Memunculkan Penjaga Kudus penyembuh saat ada rekan tim tumbang. Penjaga Kudus akan jadi lebih kuat jika rekan tim yang tumbang adalah Malaikat.","Quando un compagno di squadra viene eliminato, evochi un alleato angelico che cura. Se quel compagno era un angelo, la creatura evocata è più forte.","チームメイトが倒されると、回復役の熾天使を味方として召喚する。倒された味方が天使サイドの場合、熾天使が強化される。","팀원이 처치되면 치유의 천사 아군을 생성합니다. 처치된 팀원이 천사일 경우, 생성된 아군이 더 강해집니다.","Mewujudkan sekutu malaikat penyembuh apabila rakan sepasukan dikalahkan. Sekutu ini lebih berkuasa jika rakan sepasukan ialah Malaikat.","Roep een helende engelbondgenoot op als een teamgenoot wordt uitgeschakeld. Deze bondgenoot is sterker als de teamgenoot een engel was.","Przywołujesz anielskiego sojusznika-uzdrowiciela, gdy członek Twojej drużyny zostaje pokonany. Sojusznik jest silniejszy, jeśli pokonany członek drużyny był aniołem.","Gere um aliado angelical curativo quando um colega de equipe for derrotado. O aliado gerado é mais forte se o colega tiver sido um anjo.","Когда товарища по команде побеждают, на твоей стороне появляется ангел-целитель. Этот ангел будет сильнее, если побеждённый боец был ангелом.","เรียกเทวาเยียวยาพันธมิตรมาหนึ่งตนเมื่อเพื่อนร่วมทีมพ่ายแพ้ เทวาตนนี้จะแข็งแกร่งขึ้นหากเพื่อนร่วมทีมคนนั้นเป็นเทวา","Bir takım arkadaşın yok edildiğinde iyileştiren bir melek kurtarıcı çağırır. Yok edilen takım arkadaşın bir melekse bu kurtarıcı daha da güçlü olur.","Tạo ra một Đồng minh Thiên thần có khả năng hồi máu khi có một đồng đội bị hạ gục. Thiên thần này sẽ mạnh hơn nếu đồng đội ngã xuống cũng là một Thiên thần."
"TID_ANGEL_DARK_LARRY_&_LAWRIE_SKIN","DARK ANGEL LARRY & LAWRIE","لاري ولوري ملائكيا الظلام","暗影天使拉里和劳里","暗影天使賴瑞和羅瑞","DUNKLE ENGEL LARRY & LAWRIE","LARRY Y LAWRIE ÁNGELES CAÍDOS","SYNKKÄ ENKELI- LARRY & LAWRIE","LARRY & LAWRIE ANGES OBSCURS","לארי ולורי המלאכים האפלים","LARRY & LAWRIE MALAIKAT KEGELAPAN","LARRY E LAWRIE ANGELI OSCURI","ダークエンジェル ラリー＆ローリー","다크 엔젤 래리 & 로리","LARRY & LAWRIE MALAIKAT JAHAT","DUISTERE ENGEL-LARRY & LAWRIE","MROCZNE ANIOŁY LARRY I LAWRIE","LARRY E LAWRIE ANJOS SOMBRIOS","ТЁМНЫЕ АНГЕЛЫ ЛАРРИ И ЛОРИ","เทวามืดแลร์รี & ลอว์รี","KARA MELEK LARRY İLE LAWRIE","LARRY & LAWRIE THIÊN THẦN HẮC ÁM"
"TID_ANGEL_DARK_LARRY_&_LAWRIE_SKIN_SHOP","DARK ANGEL\nLARRY & LAWRIE","لاري ولوري\nملائكيا الظلام","暗影天使\n拉里和劳里","暗影天使\n賴瑞和羅瑞","DUNKLE ENGEL\nLARRY & LAWRIE","LARRY Y LAWRIE\nÁNGELES CAÍDOS","SYNKKÄ ENKELI-\nLARRY & LAWRIE","LARRY & LAWRIE\nANGES OBSCURS","לארי ולורי\nהמלאכים האפלים","LARRY & LAWRIE\nMALAIKAT KEGELAPAN","LARRY E LAWRIE\nANGELI OSCURI","ダークエンジェル\nラリー＆ローリー","다크 엔젤\n래리 & 로리","LARRY & LAWRIE\nMALAIKAT JAHAT","DUISTERE ENGEL-\nLARRY & LAWRIE","MROCZNE ANIOŁY\nLARRY I LAWRIE","LARRY E LAWRIE\nANJOS SOMBRIOS","ТЁМНЫЕ АНГЕЛЫ\nЛАРРИ И ЛОРИ","เทวามืด\nแลร์รี & ลอว์รี","KARA MELEK\nLARRY İLE LAWRIE","LARRY & LAWRIE\nTHIÊN THẦN HẮC ÁM"
"TID_LIGHT_ANGEL_COLT_SKIN","LIGHT ANGEL COLT","كولت ملاك الضوء","光明天使柯尔特","靛藍天使柯爾特","LICHTENGEL COLT","COLT ÁNGEL RADIANTE","VALON ENKELI -COLT","COLT ANGE DE LUMIÈRE","קולט מלאך האור","COLT MALAIKAT TERANG","COLT ANGELO LUCENTE","ライトエンジェル コルト","라이트 엔젤 콜트","COLT MALAIKAT CERAH","LICHTENGEL-COLT","ŚWIETLISTY ANIOŁ COLT","COLT ANJO RADIANTE","АНГЕЛ СВЕТА КОЛЬТ","โคลท์ เทพบุตรแห่งแสง","IŞIK MELEĞİ COLT","COLT THIÊN THẦN ÁNH SÁNG"
"TID_LIGHT_ANGEL_COLT_SKIN_SHOP","LIGHT ANGEL\nCOLT","كولت\nملاك الضوء","光明天使\n柯尔特","靛藍天使\n柯爾特","LICHTENGEL\nCOLT","COLT\nÁNGEL RADIANTE","VALON ENKELI\n-COLT","COLT\nANGE DE LUMIÈRE","קולט\nמלאך אור","COLT\nMALAIKAT TERANG","COLT\nANGELO LUCENTE","ライトエンジェル\nコルト","라이트 엔젤 콜트","COLT\nMALAIKAT CERAH","LICHTENGEL-\nCOLT","ŚWIETLISTY ANIOŁ\nCOLT","COLT\nANJO RADIANTE","АНГЕЛ СВЕТА\nКОЛЬТ","โคลท์\nเทพบุตรแห่งแสง","IŞIK MELEĞİ\nCOLT","COLT\nTHIÊN THẦN ÁNH SÁNG"
"TID_SPEC_ABI_PREY_ON_THE_WEAK_DESC","Crow deals <c00cc00>+<VALUE1>%</c> damage with his attack and Super to targets with <VALUE2>% or less health.","يلحق هجوم كرو وزخمه <c00cc00>+<VALUE1>%</c> من الضرر بالأهداف التي تملك <VALUE2>% أو أقل من الصحة.","黑鸦的普通攻击和超级技能对生命值不高于<VALUE2>%的目标伤害<c00cc00>+<VALUE1>%</c>。","鴉的普通攻擊和超級技能對生命值在<VALUE2>%以下的英雄可造成<c00cc00>額外<VALUE1>%</c>傷害。","Crow verursacht mit seinem Angriff und seinem Superskill <c00cc00>+<VALUE1> %</c> Schaden bei Zielen, deren Trefferpunkte bei <VALUE2> % oder darunter liegen.","Crow inflige un <c00cc00><VALUE1> %</c> más de daño con su ataque y su súper a los objetivos que tengan menos del <VALUE2> % de salud.","Crow'n perus- ja superhyökkäys tekevät <c00cc00><VALUE1> %</c> enemmän tuhoa kohteisiin, joilla on <VALUE2> % tai vähemmän elinvoimaa.","Lorsqu'il attaque ou utilise son super, Corbac inflige <c00cc00>+<VALUE1> %</c> de points de dégâts aux cibles ayant <VALUE2> % de santé ou moins.","קרואו גורם <c00cc00>+<VALUE1></c> נזק באמצעות המתקפה ותכונת הסופר שלו למטרות בעלות %<VALUE2> בריאות או פחות.","Serangan normal dan Kekuatan Super Crow memberikan <c00cc00>+<VALUE1>%</c> kerusakan pada target dengan kesehatan <VALUE2>% atau kurang.","Corvo infligge il <c00cc00><VALUE1>%</c> di punti danno in più sia con l'attacco base che con la super ai brawler con salute pari o inferiore al <VALUE2>%.","HPが<VALUE2>％以下の敵に対して、クロウの通常攻撃と必殺技で<c00cc00>+<VALUE1>％</c>の追加ダメージが発生する。","HP가 <VALUE2>% 이하인 대상에게 일반 및 특수 공격으로 <c00cc00>+<VALUE1>%</c> 추가 피해를 줍니다.","Crow melakukan <c00cc00>+<VALUE1>%</c> kerosakan dengan serangan dan Supernya terhadap sasaran dengan nilai nyawa <VALUE2>% atau lebih rendah.","Crow brengt met zijn aanval en super <c00cc00>+<VALUE1>%</c> schade toe aan doelwitten met maximaal <VALUE2>% van hun gezondheid.","Kruk zadaje <c00cc00>+<VALUE1>%</c> pkt. obrażeń, używając swojego ataku i superataku wobec celów mających <VALUE2>% lub mniej pkt. życia.","O ataque regular e o Super do Corvo infligem <c00cc00><VALUE1>%</c> a mais de dano a alvos com <VALUE2>% ou menos de saúde.","Атака и Супер Ворона наносят <c00cc00><VALUE1> %</c> дополнительного урона целям, уровень здоровья которых не превышает <VALUE2> %.","โครวสร้างความเสียหาย <c00cc00>+<VALUE1>%</c> ด้วยการโจมตีและท่าไม้ตายของเขาเมื่อเป้าหมายมีพลังชีวิต <VALUE2>% หรือน้อยกว่า","Crow'un normal ve süper saldırısı sağlığı %<VALUE2> ve altı düşmanlara <c00cc00>%<VALUE1></c> fazla hasar verir.","Quạ gây ra thêm <c00cc00><VALUE1>%</c> sát thương khi sử dụng đòn tấn công và Tuyệt chiêu lên những mục tiêu có từ <VALUE2>% máu trở xuống."
"TID_BIZARRE_MAISIE_SKIN","AMAZING MAISIE","مايسي المدهشة","神奇旅程麦茜","奇幻探險家","FANTASTISCHE MAISIE","MAISIE MAGNÍFICA","MIELETÖN MAISIE","MAISIE MANGA","מייזי המדהימה","MAISIE BOMBASTIS","MAISIE STRAVAGANTE","アルカナXVII メイジー","어메이징 메이지","MAISIE LUAR BIASA","GEWELDIGE MAISIE","NIESAMOWITA MAISIE","MAISIE MAROTA","НЕВЕРОЯТНАЯ МЭЙСИ","เมซี่ สาวอเมซิ่ง","MUHTEŞEM MAISIE","MAISIE SIÊU PHÀM"
"TID_BIZARRE_MAISIE_SKIN_SHOP","AMAZING\nMAISIE","مايسي\nالمدهشة","神奇旅程麦茜","奇幻探險家","FANTASTISCHE\nMAISIE","MAISIE\nMAGNÍFICA","MIELETÖN\nMAISIE","MAISIE\nMANGA","מייזי\nהמדהימה","MAISIE\nBOMBASTIS","MAISIE\nSTRAVAGANTE","アルカナXVII\nメイジー","어메이징 메이지","MAISIE\nLUAR BIASA","GEWELDIGE\nMAISIE","NIESAMOWITA\nMAISIE","MAISIE\nMAROTA","НЕВЕРОЯТНАЯ\nМЭЙСИ","เมซี่\nสาวอเมซิ่ง","MUHTEŞEM\nMAISIE","MAISIE\nSIÊU PHÀM"
"TID_TOON_KNIGHT_SKIN","ASH BOY","آش الفارس الإلكتروني","游戏机阿拾","電玩活寶","HAUDEGEN ASH","ASH INTRÉPIDO","KONSOLIRITARI-ASH","ASH AVENTUREUX","אש הגולש","GAME-ASH","ASH CONSOLE GUERRIERA","ゲーム機 アッシュ","게임기 애쉬","ASH BOY","ASH BOY","CHŁOPIEC ASH","ASH AVENTUREIRO","ЭШБОЙ","เกมบอยแอช","MACERACI ASH","ASH MÁY CHƠI GAME"
"TID_TOON_KNIGHT_SKIN_SHOP","ASH BOY","آش الفارس الإلكتروني","游戏机阿拾","電玩活寶","HAUDEGEN\nASH","ASH\nINTRÉPIDO","KONSOLIRITARI-\nASH","ASH\nAVENTUREUX","אש הגולש","GAME-ASH","ASH\nCONSOLE GUERRIERA","ゲーム機\nアッシュ","게임기 애쉬","ASH BOY","ASH BOY","CHŁOPIEC\nASH","ASH\nAVENTUREIRO","ЭШБОЙ","เกมบอยแอช","MACERACI ASH","ASH\nMÁY CHƠI GAME"
"TID_REQUIEM_BIZARRE_MAISIE_SKIN","FUCHSIA MAISIE","مايسي الفوشيا","紫红麦茜","紫紅探險家","MAGENTA MAISIE","MAISIE FUCSIA","FUKSIA-MAISIE","MAISIE FUCHSIA","מייזי פוקסיה","MAISIE FUSIA","MAISIE FUCSIA","バイオレット メイジー","바이올렛 메이지","MAISIE FUCHSIA","FUCHSIA MAISIE","FUKSJOWA MAISIE","MAISIE FÚSCIA","ФУКСИЯ МЭЙСИ","เมซี่ สาวสีม่วงฟูเซีย","FUŞYA MAISIE","MAISIE MÀU HỒNG FUCHSIA"
"TID_REQUIEM_BIZARRE_MAISIE_SKIN_SHOP","FUCHSIA\nMAISIE","مايسي\nالفوشيا","紫红麦茜","紫紅探險家","MAGENTA\nMAISIE","MAISIE\nFUCSIA","FUKSIA-\nMAISIE","MAISIE\nFUCHSIA","מייזי\nפוקסיה","MAISIE\nFUSIA","MAISIE\nFUCSIA","バイオレット\nメイジー","바이올렛 메이지","MAISIE\nFUCHSIA","FUCHSIA\nMAISIE","FUKSJOWA\nMAISIE","MAISIE\nFÚSCIA","ФУКСИЯ\nМЭЙСИ","เมซี่\nสาวสีม่วงฟูเซีย","FUŞYA\nMAISIE","MAISIE\nMÀU HỒNG FUCHSIA"
"TID_PLATINUM_BIZARRE_MAISIE_SKIN","TITANIUM MAISIE","مايسي التيتانيوم","钛金麦茜","白金探險家","TITANGLANZ MAISIE","MAISIE DE TITANIO","TITAANI-MAISIE","MAISIE TITANE","מייזי מטיטניום","MAISIE TITANIUM","MAISIE TITANIO","チタニウム メイジー","티타늄 메이지","MAISIE TITANIUM","TITANIUM MAISIE","TYTANOWA MAISIE","MAISIE TITÂNICA","ТИТАНОВАЯ МЭЙСИ","เมซี่ สาวไทเทเนียม","TİTANYUM MAISIE","MAISIE MÀU XÁM BẠC"
"TID_PLATINUM_BIZARRE_MAISIE_SKIN_SHOP","TITANIUM\nMAISIE","مايسي\nالتيتانيوم","钛金麦茜","白金探險家","TITANGLANZ\nMAISIE","MAISIE\nDE TITANIO","TITAANI-\nMAISIE","MAISIE\nTITANE","מייזי\nמטיטניום","MAISIE\nTITANIUM","MAISIE\nTITANIO","チタニウム\nメイジー","티타늄 메이지","MAISIE\nTITANIUM","TITANIUM \nMAISIE","TYTANOWA\nMAISIE","MAISIE\nTITÂNICA","ТИТАНОВАЯ\nМЭЙСИ","เมซี่\nสาวไทเทเนียม","TİTANYUM\nMAISIE","MAISIE\nMÀU XÁM BẠC"
"TID_SILENCER_OVERCHARGE","SILENT STUNNER","الصاعق الصامت","静默重压","寂靜之謎","STILLER STUN","SIN PALABRAS","HILJAINEN HILJENTÄJÄ","IMMOBILISATION SILENCIEUSE","הימום שקט","KEJUTAN HENING","SHOCK INIBITORIO","サイレントスタナー","아찔한 별딱지","PEMEGUN SENYAP","STILLE VERDOVING","CICHY OGŁUSZACZ","ATORDOADOR SILENCIOSO","БЕЗМОЛВНОЕ ОГЛУШЕНИЕ","เงียบสยบความเคลื่อนไหว","SESSİZ SERSEMLETME","KẺ GÂY CHOÁNG THẦM LẶNG"
"TID_DARK_ANGEL_EDGAR_SKIN","DARK ANGEL EDGAR","إدجار ملاك الظلام","暗黑天使艾德加","墮天使艾德加","DUNKLER ENGEL EDGAR","EDGAR ÁNGEL CAÍDO","SYNKKÄ ENKELI-EDGAR","EDGAR ANGE DÉCHU","אדגר מלאך האופל","EDGAR MALAIKAT KEGELAPAN","EDGAR ANGELO OSCURO","ダークエンジェル エドガー","다크 엔젤 에드거","EDGAR MALAIKAT JAHAT","DUISTERE ENGEL-EDGAR","MROCZNY ANIOŁ EDGAR","EDGAR ANJO DAS TREVAS","ТЁМНЫЙ АНГЕЛ ЭДГАР","เอ็ดการ์ เทพบุตรมืด","KARA MELEK EDGAR","EDGAR THIÊN THẦN HẮC ÁM"
"TID_DARK_ANGEL_EDGAR_SKIN_SHOP","DARK ANGEL\nEDGAR","إدجار\nملاك الظلام","暗黑天使\n艾德加","墮天使艾德加","DUNKLER ENGEL\nEDGAR","EDGAR\nÁNGEL CAÍDO","SYNKKÄ ENKELI-\nEDGAR","EDGAR\nANGE DÉCHU","אדגר\nמלאך האופל","EDGAR\nMALAIKAT KEGELAPAN","EDGAR\nANGELO OSCURO","ダークエンジェル\nエドガー","다크 엔젤 에드거","EDGAR\nMALAIKAT JAHAT","DUISTERE ENGEL-\nEDGAR","MROCZNY ANIOŁ\nEDGAR","EDGAR\nANJO DAS TREVAS","ТЁМНЫЙ АНГЕЛ\nЭДГАР","เอ็ดการ์\nเทพบุตรมืด","KARA MELEK\nEDGAR","EDGAR\nTHIÊN THẦN HẮC ÁM"
"TID_SPEC_ABI_REVIVER_2_DESC","Snack Attack also heals Doug by <c00cc00><VALUE1></c>.","تعالج الهجمة الغذائية دوج أيضًا بمقدار <c00cc00><VALUE1></c>.","零食旋风也会治疗道格自己，治疗量为<c00cc00><VALUE1></c>。","小吃出擊也會治療道格自己，治療量為<c00cc00><VALUE1></c>。","Snackangriff heilt Doug zusätzlich um <c00cc00><VALUE1></c>.","Ataque comilón también cura a Doug <c00cc00><VALUE1></c> de vida.","Hodarihyökkäys myös antaa Dougille <c00cc00><VALUE1></c> pistettä elinvoimaa.","Snack d'attaque guérit aussi Doug à hauteur de <c00cc00><VALUE1> PV</c>.","מתקפת הנשנוש גם מרפאה את דאג ב-<c00cc00><VALUE1></c>.","Serangan Nyam-Nyam-Nyam akan menyembuhkan Doug sebesar <c00cc00><VALUE1></c>.","Croce e delizia ripristina anche <c00cc00><VALUE1></c> dei punti salute di Doug.","通常攻撃を行うと、ダグのHPが<c00cc00><VALUE1></c>回復する。","스낵 어택이 <c00cc00><VALUE1></c>만큼 더그 자신도 치유합니다.","Serangan Kudapan juga menyembuhkan Doug sebanyak <c00cc00><VALUE1></c>.","Met zijn Snackaanval geneest Doug zichzelf met <c00cc00><VALUE1></c>.","Przekąskowy atak leczy również Douga o <c00cc00><VALUE1></c>.","O Ataque de Fome também restaura a saúde de Doug em <c00cc00><VALUE1></c>.","Атака «Быстрый перекус» также восстанавливает Дагу здоровье с <c00cc00><VALUE1>-процентной</c> эффективностью.","ของว่างแลกใจจะเยียวยาดั๊ก <c00cc00><VALUE1></c> หน่วย","Sosis saldırısı, Doug'ı ayrıca <c00cc00>%<VALUE1></c> iyileştirir.","Chiêu thức Cơn bão đồ ăn vặt cũng sẽ hồi <c00cc00><VALUE1></c> máu cho Doug."
"TID_TILE_BATTLEPASSPLUS_SEASON32","Supernatural","خارق للعادة","天选者","降臨者","Übernatürlich","Sobrenatural","Yliluonnollinen","Surnaturel","על-טבעי","Supernatural","Soprannaturale","第六感","슈퍼내추럴","Kuasa Ghaib","Bovennatuurlijk","Nadnaturalne","Sobrenatural","Сверхъестественное","เหนือธรรมชาติ","Doğaüstü","Siêu nhiên"
